{
  "id": "cloud-windows",
  "name": "Cloud Windows",
  "version": 2,
  "format": "strip",
  "categories": [
    "soft"
  ],
  "designWidth": 1200,
  "designHeight": 3600,
  "slots": [
    {
      "id": "p1",
      "order": 1,
      "x": 0.06,
      "y": 0.055,
      "w": 0.88,
      "h": 0.27,
      "shape": "path",
      "radius": 55,
      "rotationDeg": 0,
      "matteColor": "#f2efe9",
      "pathRef": "arch"
    },
    {
      "id": "p2",
      "order": 2,
      "x": 0.06,
      "y": 0.345,
      "w": 0.88,
      "h": 0.27,
      "shape": "path",
      "radius": 55,
      "rotationDeg": 0,
      "matteColor": "#f2efe9",
      "pathRef": "arch"
    },
    {
      "id": "p3",
      "order": 3,
      "x": 0.05,
      "y": 0.635,
      "w": 0.9,
      "h": 0.25,
      "shape": "roundedRect",
      "radius": 120,
      "rotationDeg": 0,
      "matteColor": "#f2efe9"
    }
  ],
  "description": "Dua jendela melengkung, awan ilustratif dan garis yang mengalir.",
  "palette": {
    "background": "#dcecfb",
    "ink": "#354c7a",
    "accent": "#8f9ed4",
    "secondary": "#ffffff"
  },
  "layers": {
    "background": "/frames/cloud-windows/v2/background.svg",
    "foreground": "/frames/cloud-windows/v2/foreground.svg"
  },
  "thumbnail": "/frames/cloud-windows/v2/thumbnail-neutral.png",
  "licenses": [
    "Original vector artwork © Fotbooth contributors. CC0-1.0.",
    "DM Sans and Fraunces: SIL Open Font License 1.1."
  ],
  "textAreas": [
    {
      "id": "title",
      "text": "Cloud Windows",
      "x": 0.06,
      "y": 0.012,
      "w": 0.88,
      "h": 0.036,
      "fontId": "serif",
      "fontSize": 100,
      "minFontSize": 48,
      "maxLines": 1,
      "color": "#354c7a"
    },
    {
      "id": "caption",
      "x": 0.07,
      "y": 0.906,
      "w": 0.86,
      "h": 0.055,
      "fontId": "serif",
      "fontSize": 60,
      "minFontSize": 32,
      "maxLines": 2,
      "color": "#354c7a"
    },
    {
      "id": "date",
      "x": 0.15,
      "y": 0.972,
      "w": 0.7,
      "h": 0.018,
      "fontId": "sans",
      "fontSize": 34,
      "minFontSize": 26,
      "maxLines": 1,
      "color": "#354c7a"
    }
  ]
}
