{
  "id": "pocket-arcade",
  "name": "Pocket Arcade",
  "version": 1,
  "format": "strip",
  "categories": [
    "playful",
    "futuristic"
  ],
  "designWidth": 1200,
  "designHeight": 3600,
  "slots": [
    {
      "id": "p1",
      "order": 1,
      "x": 0.05,
      "y": 0.065,
      "w": 0.9,
      "h": 0.19,
      "shape": "path",
      "radius": 55,
      "rotationDeg": 0,
      "matteColor": "#f2efe9",
      "pathRef": "chamfer"
    },
    {
      "id": "p2",
      "order": 2,
      "x": 0.05,
      "y": 0.275,
      "w": 0.9,
      "h": 0.19,
      "shape": "path",
      "radius": 55,
      "rotationDeg": 0,
      "matteColor": "#f2efe9",
      "pathRef": "chamfer"
    },
    {
      "id": "p3",
      "order": 3,
      "x": 0.05,
      "y": 0.485,
      "w": 0.9,
      "h": 0.19,
      "shape": "path",
      "radius": 55,
      "rotationDeg": 0,
      "matteColor": "#f2efe9",
      "pathRef": "chamfer"
    },
    {
      "id": "p4",
      "order": 4,
      "x": 0.05,
      "y": 0.695,
      "w": 0.9,
      "h": 0.19,
      "shape": "path",
      "radius": 55,
      "rotationDeg": 0,
      "matteColor": "#f2efe9",
      "pathRef": "chamfer"
    }
  ],
  "description": "Empat layar bersudut potong, indikator level dan tombol geometris.",
  "palette": {
    "background": "#2737ad",
    "ink": "#ffffff",
    "accent": "#aff56b",
    "secondary": "#4455d0"
  },
  "layers": {
    "background": "/frames/pocket-arcade/v1/background.svg",
    "foreground": "/frames/pocket-arcade/v1/foreground.svg"
  },
  "thumbnail": "/frames/pocket-arcade/v1/thumbnail.png",
  "licenses": [
    "Original vector artwork © Fotbooth contributors. CC0-1.0.",
    "DM Sans and Fraunces: SIL Open Font License 1.1."
  ],
  "textAreas": [
    {
      "id": "title",
      "text": "Pocket Arcade",
      "x": 0.06,
      "y": 0.012,
      "w": 0.88,
      "h": 0.036,
      "fontId": "sans",
      "fontSize": 100,
      "minFontSize": 48,
      "maxLines": 1,
      "color": "#ffffff"
    },
    {
      "id": "caption",
      "x": 0.07,
      "y": 0.906,
      "w": 0.86,
      "h": 0.055,
      "fontId": "sans",
      "fontSize": 60,
      "minFontSize": 32,
      "maxLines": 2,
      "color": "#ffffff"
    },
    {
      "id": "date",
      "x": 0.15,
      "y": 0.972,
      "w": 0.7,
      "h": 0.018,
      "fontId": "sans",
      "fontSize": 34,
      "minFontSize": 26,
      "maxLines": 1,
      "color": "#ffffff"
    }
  ]
}
