{
  "id": "strawberry-farm",
  "name": "Strawberry Farm",
  "version": 1,
  "format": "strip",
  "categories": [
    "playful"
  ],
  "designWidth": 1200,
  "designHeight": 3600,
  "slots": [
    {
      "id": "p1",
      "order": 1,
      "x": 0.05,
      "y": 0.1,
      "w": 0.86,
      "h": 0.18,
      "shape": "path",
      "pathRef": "heart",
      "rotationDeg": -0.7,
      "matteColor": "#f2efe9"
    },
    {
      "id": "p2",
      "order": 2,
      "x": 0.09,
      "y": 0.30000000000000004,
      "w": 0.86,
      "h": 0.18,
      "shape": "path",
      "pathRef": "burst",
      "rotationDeg": 0.7,
      "matteColor": "#f2efe9"
    },
    {
      "id": "p3",
      "order": 3,
      "x": 0.05,
      "y": 0.5,
      "w": 0.86,
      "h": 0.18,
      "shape": "path",
      "pathRef": "cloud",
      "rotationDeg": -0.7,
      "matteColor": "#f2efe9"
    },
    {
      "id": "p4",
      "order": 4,
      "x": 0.09,
      "y": 0.7000000000000001,
      "w": 0.86,
      "h": 0.18,
      "shape": "rect",
      "rotationDeg": 0.7,
      "matteColor": "#f2efe9"
    }
  ],
  "description": "Stroberi segar, keranjang panen dan taplak pasar buah. Empat foto dengan bentuk berbeda dalam satu frame.",
  "palette": {
    "background": "#f2e0d4",
    "ink": "#5c4a3d",
    "accent": "#bf6b65",
    "secondary": "#99af86"
  },
  "layers": {
    "background": "/frames/strawberry-farm/v1/background.svg",
    "foreground": "/frames/strawberry-farm/v1/foreground.svg"
  },
  "thumbnail": "/frames/strawberry-farm/v1/thumbnail-neutral.png",
  "licenses": [
    "Original vector artwork © Fotbooth contributors. CC0-1.0.",
    "DM Sans and Fraunces: SIL Open Font License 1.1."
  ],
  "textAreas": [
    {
      "id": "title",
      "text": "Strawberry Farm",
      "x": 0.09,
      "y": 0.022,
      "w": 0.82,
      "h": 0.04,
      "fontId": "sans",
      "fontSize": 76,
      "minFontSize": 48,
      "maxLines": 1,
      "color": "#5c4a3d"
    },
    {
      "id": "caption",
      "x": 0.07,
      "y": 0.92,
      "w": 0.86,
      "h": 0.04,
      "fontId": "sans",
      "fontSize": 48,
      "minFontSize": 28,
      "maxLines": 2,
      "color": "#5c4a3d"
    },
    {
      "id": "date",
      "x": 0.15,
      "y": 0.974,
      "w": 0.7,
      "h": 0.018,
      "fontId": "sans",
      "fontSize": 34,
      "minFontSize": 26,
      "maxLines": 1,
      "color": "#5c4a3d"
    }
  ],
  "collection": "Mixed Moments",
  "artwork": {
    "motif": "strawberry-farm",
    "edition": 5
  }
}
