{
  "id": "garden-paint-story",
  "name": "Garden Paint Story",
  "version": 1,
  "format": "card",
  "categories": [
    "floral",
    "nature",
    "soft"
  ],
  "designWidth": 1800,
  "designHeight": 2700,
  "slots": [
    {
      "id": "p1",
      "order": 1,
      "x": 0.06,
      "y": 0.145,
      "w": 0.88,
      "h": 0.365,
      "shape": "roundedRect",
      "radius": 40,
      "rotationDeg": 0,
      "matteColor": "#f2efe9"
    },
    {
      "id": "p2",
      "order": 2,
      "x": 0.06,
      "y": 0.555,
      "w": 0.425,
      "h": 0.32,
      "shape": "rect",
      "radius": 55,
      "rotationDeg": 0,
      "matteColor": "#f2efe9"
    },
    {
      "id": "p3",
      "order": 3,
      "x": 0.515,
      "y": 0.555,
      "w": 0.425,
      "h": 0.32,
      "shape": "path",
      "radius": 55,
      "rotationDeg": 0,
      "matteColor": "#f2efe9",
      "pathRef": "chamfer"
    }
  ],
  "description": "Tulip, sapuan cat, kelopak dan kolase kebun. Edisi Story, 3 foto.",
  "palette": {
    "background": "#fff1e8",
    "ink": "#674553",
    "accent": "#d78396",
    "secondary": "#a1bc96"
  },
  "layers": {
    "background": "/frames/garden-paint-story/v1/background.svg",
    "foreground": "/frames/garden-paint-story/v1/foreground.svg"
  },
  "thumbnail": "/frames/garden-paint-story/v1/thumbnail.png",
  "licenses": [
    "Original vector artwork © Fotbooth contributors. CC0-1.0.",
    "DM Sans and Fraunces: SIL Open Font License 1.1."
  ],
  "textAreas": [
    {
      "id": "title",
      "text": "Garden Paint",
      "x": 0.06,
      "y": 0.019,
      "w": 0.88,
      "h": 0.035,
      "fontId": "serif",
      "fontSize": 94,
      "minFontSize": 48,
      "maxLines": 1,
      "color": "#674553"
    },
    {
      "id": "caption",
      "x": 0.16,
      "y": 0.918,
      "w": 0.68,
      "h": 0.045,
      "fontId": "serif",
      "fontSize": 48,
      "minFontSize": 28,
      "maxLines": 2,
      "color": "#674553"
    },
    {
      "id": "date",
      "x": 0.15,
      "y": 0.972,
      "w": 0.7,
      "h": 0.018,
      "fontId": "sans",
      "fontSize": 34,
      "minFontSize": 26,
      "maxLines": 1,
      "color": "#674553"
    }
  ],
  "collection": "Garden Paint",
  "artwork": {
    "motif": "tulip",
    "edition": 9
  }
}
