{
  "id": "lace-story-arch",
  "name": "Sage Atelier",
  "version": 3,
  "format": "strip",
  "categories": [
    "romantic",
    "soft"
  ],
  "designWidth": 1200,
  "designHeight": 3600,
  "slots": [
    {
      "id": "p1",
      "order": 1,
      "x": 0.05,
      "y": 0.145,
      "w": 0.9,
      "h": 0.235,
      "shape": "path",
      "radius": 55,
      "rotationDeg": 0,
      "matteColor": "#f2efe9",
      "pathRef": "arch"
    },
    {
      "id": "p2",
      "order": 2,
      "x": 0.05,
      "y": 0.395,
      "w": 0.9,
      "h": 0.235,
      "shape": "roundedRect",
      "radius": 95,
      "rotationDeg": 0,
      "matteColor": "#f2efe9"
    },
    {
      "id": "p3",
      "order": 3,
      "x": 0.05,
      "y": 0.645,
      "w": 0.9,
      "h": 0.235,
      "shape": "roundedRect",
      "radius": 35,
      "rotationDeg": 0,
      "matteColor": "#f2efe9"
    }
  ],
  "description": "Kolase kain sage jacquard, satin berlipat, renda gading, anggrek dan tepian jahitan.",
  "palette": {
    "background": "#99a378",
    "ink": "#344431",
    "accent": "#c4ba98",
    "secondary": "#f8f3e6"
  },
  "layers": {
    "background": "/frames/lace-story-arch/v3/background.svg",
    "foreground": "/frames/lace-story-arch/v3/foreground.svg"
  },
  "thumbnail": "/frames/lace-story-arch/v3/thumbnail-neutral.png",
  "licenses": [
    "Original vector artwork © Fotbooth contributors. CC0-1.0.",
    "DM Sans and Fraunces: SIL Open Font License 1.1.",
    "Original signature compositions and generated material artwork for Fotbooth; no Canva template assets."
  ],
  "textAreas": [
    {
      "id": "title",
      "text": "SAGE ATELIER",
      "x": 0.12,
      "y": 0.037,
      "w": 0.76,
      "h": 0.047,
      "fontId": "serif",
      "fontSize": 105,
      "minFontSize": 45,
      "maxLines": 1,
      "color": "#344431"
    },
    {
      "id": "caption",
      "x": 0.16,
      "y": 0.918,
      "w": 0.68,
      "h": 0.045,
      "fontId": "serif",
      "fontSize": 48,
      "minFontSize": 28,
      "maxLines": 2,
      "color": "#344431"
    },
    {
      "id": "date",
      "x": 0.15,
      "y": 0.972,
      "w": 0.7,
      "h": 0.018,
      "fontId": "sans",
      "fontSize": 34,
      "minFontSize": 26,
      "maxLines": 1,
      "color": "#344431"
    }
  ],
  "collection": "Lace Story",
  "artwork": {
    "motif": "lace",
    "edition": 4
  }
}
