{
  "id": "wedding-bloom-portrait",
  "name": "Pearl Vows",
  "version": 3,
  "format": "card",
  "categories": [
    "romantic",
    "floral"
  ],
  "designWidth": 1800,
  "designHeight": 2700,
  "slots": [
    {
      "id": "p1",
      "order": 1,
      "x": 0.06,
      "y": 0.145,
      "w": 0.415,
      "h": 0.73,
      "shape": "roundedRect",
      "radius": 95,
      "rotationDeg": 0,
      "matteColor": "#f2efe9"
    },
    {
      "id": "p2",
      "order": 2,
      "x": 0.525,
      "y": 0.145,
      "w": 0.415,
      "h": 0.73,
      "shape": "roundedRect",
      "radius": 95,
      "rotationDeg": 0,
      "matteColor": "#f2efe9"
    }
  ],
  "description": "Undangan couture dengan sutra ivory, rangkaian mutiara, mawar dan ornamen emas sampanye.",
  "palette": {
    "background": "#f5ead4",
    "ink": "#5d4931",
    "accent": "#c5a061",
    "secondary": "#fcf8ed"
  },
  "layers": {
    "background": "/frames/wedding-bloom-portrait/v3/background.svg",
    "foreground": "/frames/wedding-bloom-portrait/v3/foreground.svg"
  },
  "thumbnail": "/frames/wedding-bloom-portrait/v3/thumbnail-neutral.png",
  "licenses": [
    "Original vector artwork © Fotbooth contributors. CC0-1.0.",
    "DM Sans and Fraunces: SIL Open Font License 1.1.",
    "Original signature compositions and generated material artwork for Fotbooth; no Canva template assets."
  ],
  "textAreas": [
    {
      "id": "title",
      "text": "PEARL VOWS",
      "x": 0.12,
      "y": 0.037,
      "w": 0.76,
      "h": 0.047,
      "fontId": "serif",
      "fontSize": 136,
      "minFontSize": 45,
      "maxLines": 1,
      "color": "#5d4931"
    },
    {
      "id": "caption",
      "x": 0.16,
      "y": 0.918,
      "w": 0.68,
      "h": 0.045,
      "fontId": "serif",
      "fontSize": 48,
      "minFontSize": 28,
      "maxLines": 2,
      "color": "#5d4931"
    },
    {
      "id": "date",
      "x": 0.15,
      "y": 0.972,
      "w": 0.7,
      "h": 0.018,
      "fontId": "sans",
      "fontSize": 34,
      "minFontSize": 26,
      "maxLines": 1,
      "color": "#5d4931"
    }
  ],
  "collection": "Wedding Bloom",
  "artwork": {
    "motif": "rings",
    "edition": 7
  }
}
