{
  "id": "aquarium-parade",
  "name": "Aquarium Parade",
  "version": 2,
  "format": "card",
  "categories": [
    "nature",
    "dynamic",
    "scrapbook"
  ],
  "designWidth": 1800,
  "designHeight": 2700,
  "slots": [
    {
      "id": "p1",
      "order": 1,
      "x": 0.045,
      "y": 0.135,
      "w": 0.87,
      "h": 0.34199999999999997,
      "shape": "path",
      "rotationDeg": -1.2,
      "matteColor": "#f2efe9",
      "pathRef": "wave"
    },
    {
      "id": "p2",
      "order": 2,
      "x": 0.085,
      "y": 0.5129999999999999,
      "w": 0.87,
      "h": 0.34199999999999997,
      "shape": "path",
      "rotationDeg": 1.2,
      "matteColor": "#f2efe9",
      "pathRef": "star"
    }
  ],
  "description": "Dua foto berlekuk ombak dan bintang laut, tersusun berselang di antara koral dan gelembung.",
  "palette": {
    "background": "#076e80",
    "ink": "#e9fffa",
    "accent": "#e8a85d",
    "secondary": "#ec7794"
  },
  "layers": {
    "background": "/frames/aquarium-parade/v2/background.svg",
    "foreground": "/frames/aquarium-parade/v2/foreground.svg"
  },
  "thumbnail": "/frames/aquarium-parade/v2/thumbnail-neutral.png",
  "licenses": [
    "Original vector artwork © Fotbooth contributors. CC0-1.0.",
    "DM Sans and Fraunces: SIL Open Font License 1.1.",
    "Original material artwork generated for Fotbooth with the built-in ImageGen tool."
  ],
  "textAreas": [
    {
      "id": "title",
      "text": "AQUARIUM PARADE",
      "x": 0.07,
      "y": 0.024,
      "w": 0.86,
      "h": 0.043,
      "fontId": "sans",
      "fontSize": 100,
      "minFontSize": 48,
      "maxLines": 1,
      "color": "#e9fffa"
    },
    {
      "id": "caption",
      "x": 0.12,
      "y": 0.894,
      "w": 0.76,
      "h": 0.05,
      "fontId": "sans",
      "fontSize": 61,
      "minFontSize": 32,
      "maxLines": 2,
      "color": "#076e80"
    },
    {
      "id": "date",
      "x": 0.2,
      "y": 0.965,
      "w": 0.6,
      "h": 0.018,
      "fontId": "sans",
      "fontSize": 32,
      "minFontSize": 26,
      "maxLines": 1,
      "color": "#e9fffa"
    }
  ],
  "collection": "Festival Editions",
  "artwork": {
    "motif": "aquarium-parade",
    "edition": 1
  }
}
