{
  "id": "snow-globe",
  "name": "Snow Globe Club",
  "version": 1,
  "format": "strip",
  "categories": [
    "seasonal",
    "dynamic",
    "scrapbook"
  ],
  "designWidth": 1200,
  "designHeight": 3600,
  "slots": [
    {
      "id": "p1",
      "order": 1,
      "x": 0.09,
      "y": 0.105,
      "w": 0.82,
      "h": 0.235,
      "shape": "roundedRect",
      "radius": 55,
      "rotationDeg": 0,
      "matteColor": "#f2efe9"
    },
    {
      "id": "p2",
      "order": 2,
      "x": 0.09,
      "y": 0.365,
      "w": 0.82,
      "h": 0.235,
      "shape": "roundedRect",
      "radius": 55,
      "rotationDeg": 0,
      "matteColor": "#f2efe9"
    },
    {
      "id": "p3",
      "order": 3,
      "x": 0.09,
      "y": 0.625,
      "w": 0.82,
      "h": 0.235,
      "shape": "roundedRect",
      "radius": 55,
      "rotationDeg": 0,
      "matteColor": "#f2efe9"
    }
  ],
  "description": "Chalet bersalju, penguin, syal rajut, ski dan kristal es.",
  "palette": {
    "background": "#4d799e",
    "ink": "#fff8e9",
    "accent": "#bd455e",
    "secondary": "#afd6e6"
  },
  "layers": {
    "background": "/frames/snow-globe/v1/background.svg",
    "foreground": "/frames/snow-globe/v1/foreground.svg"
  },
  "thumbnail": "/frames/snow-globe/v1/thumbnail-neutral.png",
  "licenses": [
    "Original vector artwork © Fotbooth contributors. CC0-1.0.",
    "DM Sans and Fraunces: SIL Open Font License 1.1.",
    "Original material artwork generated for Fotbooth with the built-in ImageGen tool."
  ],
  "textAreas": [
    {
      "id": "title",
      "text": "SNOW GLOBE CLUB",
      "x": 0.07,
      "y": 0.024,
      "w": 0.86,
      "h": 0.043,
      "fontId": "sans",
      "fontSize": 83,
      "minFontSize": 48,
      "maxLines": 1,
      "color": "#fff8e9"
    },
    {
      "id": "caption",
      "x": 0.12,
      "y": 0.894,
      "w": 0.76,
      "h": 0.05,
      "fontId": "sans",
      "fontSize": 53,
      "minFontSize": 32,
      "maxLines": 2,
      "color": "#4d799e"
    },
    {
      "id": "date",
      "x": 0.2,
      "y": 0.965,
      "w": 0.6,
      "h": 0.018,
      "fontId": "sans",
      "fontSize": 32,
      "minFontSize": 26,
      "maxLines": 1,
      "color": "#fff8e9"
    }
  ],
  "collection": "Festival Editions",
  "artwork": {
    "motif": "snow-globe",
    "edition": 1
  }
}
