{
  "id": "pop-doodle-wander",
  "name": "Pop Doodle Wander",
  "version": 2,
  "format": "strip",
  "categories": [
    "cartoon",
    "playful",
    "dynamic"
  ],
  "designWidth": 1200,
  "designHeight": 3600,
  "slots": [
    {
      "id": "p1",
      "order": 1,
      "x": 0.07,
      "y": 0.155,
      "w": 0.86,
      "h": 0.22,
      "shape": "roundedRect",
      "radius": 45,
      "rotationDeg": -1.3,
      "matteColor": "#f2efe9"
    },
    {
      "id": "p2",
      "order": 2,
      "x": 0.095,
      "y": 0.405,
      "w": 0.83,
      "h": 0.22,
      "shape": "roundedRect",
      "radius": 70,
      "rotationDeg": 1.2,
      "matteColor": "#f2efe9"
    },
    {
      "id": "p3",
      "order": 3,
      "x": 0.06,
      "y": 0.655,
      "w": 0.88,
      "h": 0.22,
      "shape": "roundedRect",
      "radius": 35,
      "rotationDeg": -1,
      "matteColor": "#f2efe9"
    }
  ],
  "description": "Smiley, doodle tangan, petir, bintang dan stiker pop. Edisi Wander, 3 foto.",
  "palette": {
    "background": "#fcf0bd",
    "ink": "#574654",
    "accent": "#e89a9e",
    "secondary": "#a9b5de"
  },
  "layers": {
    "background": "/frames/pop-doodle-wander/v2/background.svg",
    "foreground": "/frames/pop-doodle-wander/v2/foreground.svg"
  },
  "thumbnail": "/frames/pop-doodle-wander/v2/thumbnail-neutral.png",
  "licenses": [
    "Original vector artwork © Fotbooth contributors. CC0-1.0.",
    "DM Sans and Fraunces: SIL Open Font License 1.1."
  ],
  "textAreas": [
    {
      "id": "title",
      "text": "Pop Doodle",
      "x": 0.06,
      "y": 0.019,
      "w": 0.88,
      "h": 0.035,
      "fontId": "sans",
      "fontSize": 74,
      "minFontSize": 48,
      "maxLines": 1,
      "color": "#574654"
    },
    {
      "id": "caption",
      "x": 0.16,
      "y": 0.918,
      "w": 0.68,
      "h": 0.045,
      "fontId": "sans",
      "fontSize": 48,
      "minFontSize": 28,
      "maxLines": 2,
      "color": "#574654"
    },
    {
      "id": "date",
      "x": 0.15,
      "y": 0.972,
      "w": 0.7,
      "h": 0.018,
      "fontId": "sans",
      "fontSize": 34,
      "minFontSize": 26,
      "maxLines": 1,
      "color": "#574654"
    }
  ],
  "collection": "Pop Doodle",
  "artwork": {
    "motif": "smiley",
    "edition": 1
  }
}
