{
  "id": "cosmic-disco-mosaic",
  "name": "Cosmic Disco Mosaic",
  "version": 1,
  "format": "card",
  "categories": [
    "futuristic",
    "party",
    "dynamic"
  ],
  "designWidth": 1800,
  "designHeight": 2700,
  "slots": [
    {
      "id": "p1",
      "order": 1,
      "x": 0.06,
      "y": 0.145,
      "w": 0.425,
      "h": 0.34,
      "shape": "roundedRect",
      "radius": 55,
      "rotationDeg": 0,
      "matteColor": "#f2efe9"
    },
    {
      "id": "p2",
      "order": 2,
      "x": 0.515,
      "y": 0.145,
      "w": 0.425,
      "h": 0.34,
      "shape": "roundedRect",
      "radius": 55,
      "rotationDeg": 0,
      "matteColor": "#f2efe9"
    },
    {
      "id": "p3",
      "order": 3,
      "x": 0.06,
      "y": 0.535,
      "w": 0.425,
      "h": 0.34,
      "shape": "roundedRect",
      "radius": 55,
      "rotationDeg": 0,
      "matteColor": "#f2efe9"
    },
    {
      "id": "p4",
      "order": 4,
      "x": 0.515,
      "y": 0.535,
      "w": 0.425,
      "h": 0.34,
      "shape": "roundedRect",
      "radius": 55,
      "rotationDeg": 0,
      "matteColor": "#f2efe9"
    }
  ],
  "description": "Bola disko mozaik, bintang dan orbit neon. Edisi Mosaic, 4 foto.",
  "palette": {
    "background": "#282440",
    "ink": "#fff3de",
    "accent": "#d496d8",
    "secondary": "#a2c3e4"
  },
  "layers": {
    "background": "/frames/cosmic-disco-mosaic/v1/background.svg",
    "foreground": "/frames/cosmic-disco-mosaic/v1/foreground.svg"
  },
  "thumbnail": "/frames/cosmic-disco-mosaic/v1/thumbnail.png",
  "licenses": [
    "Original vector artwork © Fotbooth contributors. CC0-1.0.",
    "DM Sans and Fraunces: SIL Open Font License 1.1."
  ],
  "textAreas": [
    {
      "id": "title",
      "text": "Cosmic Disco",
      "x": 0.06,
      "y": 0.019,
      "w": 0.88,
      "h": 0.035,
      "fontId": "sans",
      "fontSize": 94,
      "minFontSize": 48,
      "maxLines": 1,
      "color": "#fff3de"
    },
    {
      "id": "caption",
      "x": 0.16,
      "y": 0.918,
      "w": 0.68,
      "h": 0.045,
      "fontId": "sans",
      "fontSize": 48,
      "minFontSize": 28,
      "maxLines": 2,
      "color": "#483b45"
    },
    {
      "id": "date",
      "x": 0.15,
      "y": 0.972,
      "w": 0.7,
      "h": 0.018,
      "fontId": "sans",
      "fontSize": 34,
      "minFontSize": 26,
      "maxLines": 1,
      "color": "#fff3de"
    }
  ],
  "collection": "Cosmic Disco",
  "artwork": {
    "motif": "disco",
    "edition": 8
  }
}
