{
  "id": "concert-pass",
  "name": "After Hours Ticket",
  "version": 3,
  "format": "strip",
  "categories": [
    "clean",
    "futuristic"
  ],
  "designWidth": 1200,
  "designHeight": 3600,
  "slots": [
    {
      "id": "p1",
      "order": 1,
      "x": 0.05,
      "y": 0.07,
      "w": 0.9,
      "h": 0.52,
      "shape": "rect",
      "radius": 55,
      "rotationDeg": 0,
      "matteColor": "#f2efe9"
    },
    {
      "id": "p2",
      "order": 2,
      "x": 0.05,
      "y": 0.65,
      "w": 0.9,
      "h": 0.235,
      "shape": "rect",
      "radius": 55,
      "rotationDeg": 0,
      "matteColor": "#f2efe9"
    }
  ],
  "description": "Tiket photobooth malam dengan kertas perforasi, cap foil, nomor cetak dan barcode dekoratif.",
  "palette": {
    "background": "#112747",
    "ink": "#242b39",
    "accent": "#a38750",
    "secondary": "#f7f3e9"
  },
  "layers": {
    "background": "/frames/concert-pass/v3/background.svg",
    "foreground": "/frames/concert-pass/v3/foreground.svg"
  },
  "thumbnail": "/frames/concert-pass/v3/thumbnail-neutral.png",
  "licenses": [
    "Original vector artwork © Fotbooth contributors. CC0-1.0.",
    "DM Sans and Fraunces: SIL Open Font License 1.1.",
    "Original signature compositions and generated material artwork for Fotbooth; no Canva template assets."
  ],
  "textAreas": [
    {
      "id": "title",
      "text": "AFTER HOURS",
      "x": 0.12,
      "y": 0.015,
      "w": 0.76,
      "h": 0.03,
      "fontId": "serif",
      "fontSize": 97,
      "minFontSize": 45,
      "maxLines": 1,
      "color": "#242b39"
    },
    {
      "id": "caption",
      "x": 0.07,
      "y": 0.906,
      "w": 0.86,
      "h": 0.055,
      "fontId": "sans",
      "fontSize": 60,
      "minFontSize": 32,
      "maxLines": 2,
      "color": "#242b39"
    },
    {
      "id": "date",
      "x": 0.15,
      "y": 0.972,
      "w": 0.7,
      "h": 0.018,
      "fontId": "sans",
      "fontSize": 34,
      "minFontSize": 26,
      "maxLines": 1,
      "color": "#242b39"
    }
  ]
}
