{
  "id": "ribbon-diary-trio",
  "name": "Ribbon Diary Trio",
  "version": 1,
  "format": "strip",
  "categories": [
    "romantic",
    "soft"
  ],
  "designWidth": 1200,
  "designHeight": 3600,
  "slots": [
    {
      "id": "p1",
      "order": 1,
      "x": 0.075,
      "y": 0.155,
      "w": 0.85,
      "h": 0.225,
      "shape": "roundedRect",
      "radius": 55,
      "rotationDeg": 0,
      "matteColor": "#f2efe9"
    },
    {
      "id": "p2",
      "order": 2,
      "x": 0.075,
      "y": 0.405,
      "w": 0.85,
      "h": 0.225,
      "shape": "roundedRect",
      "radius": 55,
      "rotationDeg": 0,
      "matteColor": "#f2efe9"
    },
    {
      "id": "p3",
      "order": 3,
      "x": 0.075,
      "y": 0.655,
      "w": 0.85,
      "h": 0.225,
      "shape": "roundedRect",
      "radius": 55,
      "rotationDeg": 0,
      "matteColor": "#f2efe9"
    }
  ],
  "description": "Pita satin, renda scallop, mutiara dan label buku harian. Edisi Trio, 3 foto.",
  "palette": {
    "background": "#fff0f4",
    "ink": "#743747",
    "accent": "#d86787",
    "secondary": "#c5b6df"
  },
  "layers": {
    "background": "/frames/ribbon-diary-trio/v1/background.svg",
    "foreground": "/frames/ribbon-diary-trio/v1/foreground.svg"
  },
  "thumbnail": "/frames/ribbon-diary-trio/v1/thumbnail.png",
  "licenses": [
    "Original vector artwork © Fotbooth contributors. CC0-1.0.",
    "DM Sans and Fraunces: SIL Open Font License 1.1."
  ],
  "textAreas": [
    {
      "id": "title",
      "text": "Ribbon Diary",
      "x": 0.06,
      "y": 0.019,
      "w": 0.88,
      "h": 0.035,
      "fontId": "serif",
      "fontSize": 74,
      "minFontSize": 48,
      "maxLines": 1,
      "color": "#743747"
    },
    {
      "id": "caption",
      "x": 0.16,
      "y": 0.918,
      "w": 0.68,
      "h": 0.045,
      "fontId": "serif",
      "fontSize": 48,
      "minFontSize": 28,
      "maxLines": 2,
      "color": "#743747"
    },
    {
      "id": "date",
      "x": 0.15,
      "y": 0.972,
      "w": 0.7,
      "h": 0.018,
      "fontId": "sans",
      "fontSize": 34,
      "minFontSize": 26,
      "maxLines": 1,
      "color": "#743747"
    }
  ],
  "collection": "Ribbon Diary",
  "artwork": {
    "motif": "bow",
    "edition": 0
  }
}
